1197,姚文智,107年直轄市市長選舉,首次申報,1070905,交通旅運支出,誠品行旅,53931593,0.00,33783.00,差旅膳宿支出,金錢,臺北市信義區****,,
33,江秉彝,107年直轄市議員選舉,首次申報,1070903,雜支支出,誠品股份有限公司,23155531,0.00,544.00,書報雜誌費用,金錢,臺北市信義區****,,
10,楊時睿,107年直轄市議員選舉,首次申報,1070512,雜支支出,誠品生活股份有限公司,27952966,0.00,111.00,餐飲費用,金錢,臺北市信義區****,,
63,楊時睿,107年直轄市議員選舉,首次申報,1070701,雜支支出,誠品生活股份有限公司,27952966,0.00,110.00,餐飲費用,金錢,臺北市信義區****,,
64,楊時睿,107年直轄市議員選舉,首次申報,1070701,雜支支出,誠品生活股份有限公司,27952966,0.00,232.00,餐飲費用,金錢,臺北市信義區****,,
748,羅智強,107年直轄市議員選舉,第二次賸餘,1091207,當選後與其公務有關之費用支出,誠品書局,27952966,0.00,334.00,,,,書報雜誌費用,金錢,,,,,,,,,
